{
  "items": [
    {
      "id": "reed_satchel",
      "name": "Courier Satchel",
      "category": "equipment",
      "rarityId": "common",
      "itemLevel": 1,
      "comparison": {
        "slotIds": [
          "chest"
        ],
        "majorStats": {
          "defense": 1
        }
      },
      "provenance": {
        "kind": "generic"
      },
      "unique": false,
      "requirements": {
        "startYear": 900,
        "endYear": 901
      },
      "enhancement": {
        "maxRank": 0,
        "maxRestoration": 0
      },
      "merchant": {
        "eligible": true,
        "archetypeIds": [
          "reed_outfitter"
        ],
        "settlementIds": [
          "reed_harbor"
        ]
      },
      "evidenceIds": []
    }
  ],
  "equipmentSets": [],
  "schemaVersion": 1,
  "rarities": [
    {
      "id": "common",
      "name": "Common",
      "rank": 0
    },
    {
      "id": "fine",
      "name": "Fine",
      "rank": 1
    }
  ],
  "effects": [],
  "merchantArchetypes": [
    {
      "id": "reed_outfitter",
      "stockLimit": 2
    }
  ],
  "historicalEvidence": []
}
